{
  "schema_version": "1.0",
  "chapter": {
    "id": "behavior.macro",
    "title": "Macro Behaviors",
    "documentation_url": "https://aressc2.github.io/ares-sc2/api_reference/behaviors/macro_behaviors.html"
  },
  "source": {
    "ares_version": "3.9.6",
    "git_commit": "0ac34b87f9471979f8de19a77020eed2d8693b26"
  },
  "entries": [
    {
      "id": "macro.addon_swap",
      "name": "AddonSwap",
      "kind": "executable_behavior",
      "description": "For Terran only, swap 3x3 structures. Pass in two structures and they will swap positions.",
      "documentation_status": "documented",
      "api": {
        "import": "ares.behaviors.macro.addon_swap.AddonSwap",
        "source_path": "ares-sc2/src/ares/behaviors/macro/addon_swap.py",
        "dispatch": "register_behavior"
      },
      "params": [
        {
          "name": "structure_needing_addon",
          "type": "unit_or_unit_type_id",
          "python_type": "Unit | UnitID",
          "input": "model",
          "required": true,
          "description": "The structure type we want the addon for."
        },
        {
          "name": "addon_required",
          "type": "unit_type_id",
          "python_type": "UnitID",
          "input": "model",
          "required": true,
          "description": "Type of addon required."
        },
        {
          "name": "precise_addon_structure_id",
          "type": "unit_type_id",
          "python_type": "UnitID | None",
          "input": "model",
          "required": false,
          "description": "Precise addon structure id.",
          "default": null
        }
      ],
      "parser": {
        "mode": "construct_and_register",
        "instruction_shape": "{id, args}"
      },
      "llm_exposure": "eligible"
    },
    {
      "id": "macro.auto_supply",
      "name": "AutoSupply",
      "kind": "executable_behavior",
      "description": "Automatically build supply, works for all races.",
      "documentation_status": "documented",
      "api": {
        "import": "ares.behaviors.macro.auto_supply.AutoSupply",
        "source_path": "ares-sc2/src/ares/behaviors/macro/auto_supply.py",
        "dispatch": "register_behavior"
      },
      "params": [
        {
          "name": "base_location",
          "type": "point_ref",
          "python_type": "Point2",
          "input": "model",
          "required": true,
          "description": "The base location where supply should be built."
        },
        {
          "name": "return_true_if_supply_required",
          "type": "boolean",
          "python_type": "bool",
          "input": "model",
          "required": false,
          "description": "If supply can't be afforded but is required, return true. Useful for creating a `MacroPlan`.",
          "default": true
        },
        {
          "name": "closest_to",
          "type": "point_ref",
          "python_type": "Point2 | None",
          "input": "model",
          "required": false,
          "description": "Find available supply placement closest to this location. Only applicable to Terran or Protoss.",
          "default": null
        }
      ],
      "parser": {
        "mode": "construct_and_register",
        "instruction_shape": "{id, args}"
      },
      "llm_exposure": "eligible"
    },
    {
      "id": "macro.build_structure",
      "name": "BuildStructure",
      "kind": "executable_behavior",
      "description": "Handy convenience building structure behavior. Especially combined with `Mining` and ares built in placement solver. Finds an ideal mining worker, and an available precalculated placement. Then removes worker from mining records and provides a new role.",
      "documentation_status": "documented",
      "availability": {
        "mode": "bc_build_frontier"
      },
      "api": {
        "import": "ares.behaviors.macro.build_structure.BuildStructure",
        "source_path": "ares-sc2/src/ares/behaviors/macro/build_structure.py",
        "dispatch": "register_behavior"
      },
      "params": [
        {
          "name": "base_location",
          "type": "point_ref",
          "python_type": "Point2",
          "input": "model",
          "required": true,
          "description": "The base location to build near."
        },
        {
          "name": "structure_id",
          "type": "unit_type_id",
          "python_type": "UnitID",
          "input": "model",
          "required": true,
          "description": "The structure type we want to build."
        },
        {
          "name": "max_on_route",
          "type": "integer",
          "python_type": "int",
          "input": "model",
          "required": false,
          "description": "The max number of workers on route to build this. Defaults to 1.",
          "default": 1
        },
        {
          "name": "first_pylon",
          "type": "boolean",
          "python_type": "bool",
          "input": "model",
          "required": false,
          "description": "Will look for the first pylon in placements dict. Defaults to False.",
          "default": false
        },
        {
          "name": "static_defence",
          "type": "boolean",
          "python_type": "bool",
          "input": "model",
          "required": false,
          "description": "Will look for static defense in placements dict. Defaults to False.",
          "default": false
        },
        {
          "name": "wall",
          "type": "boolean",
          "python_type": "bool",
          "input": "model",
          "required": false,
          "description": "Find wall placement if possible. Only the main base is currently supported. Defaults to False.",
          "default": false
        },
        {
          "name": "closest_to",
          "type": "point_ref",
          "python_type": "Point2 | None",
          "input": "model",
          "required": false,
          "description": "Find placement at this base closest to the given point. Optional.",
          "default": null
        },
        {
          "name": "to_count",
          "type": "integer",
          "python_type": "int",
          "input": "model",
          "required": false,
          "description": "Prevent going over this amount in total. Defaults to 0, turning this check off.",
          "default": 0
        },
        {
          "name": "to_count_per_base",
          "type": "integer",
          "python_type": "int",
          "input": "model",
          "required": false,
          "description": "Prevent going over this amount at this base location. Defaults to 0, turning this check off.",
          "default": 0
        },
        {
          "name": "tech_progress_check",
          "type": "number",
          "python_type": "float",
          "input": "model",
          "required": false,
          "description": "Check if tech is ready before trying to build. Defaults to 0.85; setting it to 0.0 turns this check off.",
          "default": 0.85
        },
        {
          "name": "supply_depot",
          "type": "boolean",
          "python_type": "bool",
          "input": "model",
          "required": false,
          "description": "Choose a predefined supply depot location. Defaults to False.",
          "default": false
        },
        {
          "name": "missile_turret",
          "type": "boolean",
          "python_type": "bool",
          "input": "model",
          "required": false,
          "description": "Choose a predefined missile turret location. Defaults to False.",
          "default": false
        },
        {
          "name": "sensor_tower",
          "type": "boolean",
          "python_type": "bool",
          "input": "model",
          "required": false,
          "description": "Choose a predefined sensor tower location. Defaults to False.",
          "default": false
        },
        {
          "name": "upgrade_structure",
          "type": "boolean",
          "python_type": "bool",
          "input": "model",
          "required": false,
          "description": "Choose a predefined upgrade-structure location. Defaults to False.",
          "default": false
        },
        {
          "name": "production",
          "type": "boolean",
          "python_type": "bool",
          "input": "model",
          "required": false,
          "description": "Choose a predefined production location. Defaults to True.",
          "default": true
        },
        {
          "name": "bunker",
          "type": "boolean",
          "python_type": "bool",
          "input": "model",
          "required": false,
          "description": "Choose a predefined bunker location. Defaults to False.",
          "default": false
        },
        {
          "name": "reaper_wall",
          "type": "boolean",
          "python_type": "bool",
          "input": "model",
          "required": false,
          "description": "Choose a predefined reaper wall location. Defaults to False.",
          "default": false
        },
        {
          "name": "find_alternative",
          "type": "boolean",
          "python_type": "bool",
          "input": "model",
          "required": false,
          "description": "If no placements are available at this base, optionally search nearby bases. Defaults to True.",
          "default": true
        }
      ],
      "parser": {
        "mode": "construct_and_register",
        "instruction_shape": "{id, args}"
      },
      "llm_exposure": "eligible"
    },
    {
      "id": "macro.build_workers",
      "name": "BuildWorkers",
      "kind": "executable_behavior",
      "description": "Finds idle townhalls / larvae and build workers.",
      "documentation_status": "documented",
      "api": {
        "import": "ares.behaviors.macro.build_workers.BuildWorkers",
        "source_path": "ares-sc2/src/ares/behaviors/macro/build_workers.py",
        "dispatch": "register_behavior"
      },
      "params": [
        {
          "name": "to_count",